<?xml version="1.0" encoding="UTF-8"?>

<!DOCTYPE daftar-buku SYSTEM "daftar-buku.dtd">
<daftar-buku>
	<buku>
		<judul>XML untuk Pemula</judul>
		<pengarang>Ozalif Routing</pengarang>
	</buku>
	<buku>
		<judul>Belajar XML dalam Sekejap Mata</judul>
		<pengarang>Stefanus Sendana</pengarang>
	</buku>
	<buku>
		<judul>Mahir XML dan XSLT dalam 60 menit</judul>
		<pengarang>Eko Widiyanto</pengarang>
	</buku>
</daftar-buku>